id,fecha_aproximada,contenido,cantidad_respuestas_aprox,comentarios_usuarios,compartidos,enlace,reacciones,sentimiento_contenido,prob_POS_contenido,prob_NEG_contenido,prob_NEU_contenido,sentimiento_comentarios
74,1 de junio a las 8:09 pm,"""En Detalles"" por ABCTV, canales 19 de TigoStar y 3 de Personal tv",0,,3 veces compartido,https://www.facebook.com/evargaspena/videos/494574800348848/?__cft__[0]=AZU4iu27l3hn4OPxH_qp_NoWlaOwulbKDKG4_c9XwIPJSttR317solfgt07WfSrSZ_4_CyKOPnmoWKQhsUxRbcfsyeF_HiGLM-_X6fSyiiF7YCGazkeDdhioXmmvCwFgqWHk1M_4ps8vCfodBqqmIISzXo6y3URtOKYhT7vc3l1DlMB07q8ZJ2d2_VyisdKNtSLp1Pr70A7E1gKT-EEHRx_7&__tn__=%2CO%2CP-R,,NEU,0.17246821522712708,0.05314471200108528,0.7743871212005615,SIN_COMENTARIO
75,1 de junio a las 9:20 am,"Escribí ""Lo que reveló el caso de Miguel Prieto""",0,,14 veces compartido,https://www.facebook.com/evargaspena/videos/1405369207324189/?__cft__[0]=AZUmVnU92G3RGb7tw4qAfNiFSltX5Lejdace7ZdL7b1F3Agg7gqRndpNu1ZWmJMX75yq6fEJvjA5GhL3Ke_pAQ-LZjtCxgbGyqgCbVMcQ5T8bMMuwKWPS_X-1_NxXAUIpgwchxDbL2a82J3HpWo42cHLZ6ff8u45CrIYSKzW2X8pwTriIYkF0uQIDb9Dtf8Uzv1jnA-zpQiBswgrVosuFTOD&__tn__=%2CO%2CP-R,,NEU,0.05674516409635544,0.38700464367866516,0.5562502145767212,SIN_COMENTARIO
76,30 de mayo a las 6:39 pm,,3,Gran vendido co carruaje,1 vez compartido,https://www.facebook.com/evargaspena/videos/1728291694446388/?__cft__[0]=AZUKS900PFZau_KhmJS9S_zb05uHKJ5vBKmod1wEjkbZ1IW4GfRxGJqzvx9bbKA7qYuYQTycPQH2oKHOTiy4wRW8of0FbL6plz40CZAU-VRR5ZDyPOaEdADGkAfzp28Z4qH5az2bi-gqqQ7zpWF2QMHJ--FAXce1dNTga_6wZrbrBgA6GsnX6srVwc-jjMABPTxv_UIkDscJXlYoP197kKCM&__tn__=%2CO%2CP-R,3.0,NEU,0.17293284833431244,0.35219326615333557,0.4748738706111908,NEG
77,30 de mayo a las 8:33 am,Lo que está pasando en EEUU con los jueces promovidos por el globalismo demuestra más allá de toda duda razonable que hay que evidenciar y poner en conocimiento público que acá también hay copamiento globalista del @PoderJudicialPY,0,Y no te preocupes de nuestra justicia corrupta nde carrauje!!!,4 veces compartido,https://www.facebook.com/evargaspena/posts/pfbid02UwpTx2QBVNFH71zyFGyWsqBbW1Tsjuxr3eJmq5gDLjPdX2U1P7PbRv3Yk4S4Fs4al?__cft__[0]=AZUHS-ihfuVm9qz_cgRkos7D3_5gAoGXn-0yTcCSJXLI52q7Kn1ZoSnY3A6sEL3gRrUW9pDZbuSREZQLoIaGoSNp3qjuvfrMEhEk8Z7qaz-Cep_OgZpt5dnJ-U0KRxrr66o5hibauvH8H5de-S9NIcLgt5bKec9JyNTD4SoD-j4rpgLKhCBMiMcxBG3it1Mcz9U&__tn__=%2CO%2CP-R,2.0,NEG,0.01573023572564125,0.8888033628463745,0.09546645730733871,NEG
78,30 de mayo a las 4:15 am,"Anoche, Juan Carlos Arévalos, abogado de @MiguelPrietoCDE, justificó la nulidad de informe de @contraloriapy que pidieron a Tribunal de Cuentas alegando que el mismo suplanta al Poder Ejecutivo y discutiendo gradación que da a irregularidades admitidas. Y @TSJE_Py sobre elección",12,"El que nada Debe, nada Teme!!",,https://www.facebook.com/evargaspena/videos/1035709768192720/?__cft__[0]=AZXH0w1m5TJeIu6QMLpFOkGFYQARcxyBUl7Qtsk2OSbUfvpvG-mNgaJUwSTZXDj-K--eX_Vgf8AhJweJoAoD6w8XnlSClfel9gqt382eODDx6hDlmzfkKQPh1AtpF5BQZMWZDGnXSdF7gMDqY5-9uExbKU_HC6_T3339sg3ZgpkyO7noRkUYDhzVMi3RG3pxo1yPKxIjElVrj00wwxd4SlbF&__tn__=%2CO%2CP-R,,NEG,0.02017216570675373,0.5691115260124207,0.41071635484695435,NEU
79,29 de mayo a las 7:55 pm,"A partir de las 20 horas estoy en ABCTV, en ""Mesa"", canales 19 de TigoStar y 3 de Personal tv",0,Interesantísimo quiero escucharlos.,1 vez compartido,https://www.facebook.com/evargaspena/videos/1847245059391621/?__cft__[0]=AZWaUyk6I8FousTzWxx4O4DAuSLajAAj6tSj88Dajj6FfZkLk8FrKEG6ljMLvlYuz0GHuXnr-6ZKtnhEShTTLdn7b6ZrzuVwCuLrWwfV94FQQA90qAVcC05lafoFMZxB2AOTybhIqaM8kyu0rmg8jbPipxgW50UDcGuWRAxe1qHbXqKHTXMH0wNeK1Gsa5QJFytXg3KD5aqPO5TaofQqA1Lf&__tn__=%2CO%2CP-R,,NEU,0.15050607919692993,0.04011036828160286,0.8093835115432739,POS
80,29 de mayo a las 4:28 pm,Varios temitas antes del fin de semana,0,Eso de pasar los nros de las denuncias....como bien dijiste.. denuncia no se puede saber si es verdad o falsa!@..y abundan las falsa,3 veces compartido,https://www.facebook.com/evargaspena/videos/700055486128319/?__cft__[0]=AZUU52RGr0orMs3YeiaYI7tUQ7X03TIVW5YTcOFGHtyOw9U4DnHQkCXXGMBQynf9Zy3yIzAI6mBwt97eeTuo9e8Tvb1uJAEyyuBIIqwbHGKjNXllgQvccUrKIih4vT8wlH8wRbgnrP6isGhlQk93ro_Vkb12vqlF8pzugeb6TLJZF9LhjG5MnMZZCo0X28-mJEhKRp0z13BJY4NB7RlRARDF&__tn__=%2CO%2CP-R,,NEU,0.38211551308631897,0.025786053389310837,0.5920984148979187,NEG
81,29 de mayo a las 9:14 am,"Ministro @JavierGimenezGZ, @MIC_PY, agregó esta mañana, en LPM por la 7.30 AM ABC Cardinal, Paraguay, que durante el último viaje de @SantiPenap con Emiratos Árabes Unidos se trabajó en la aplicación de su Fondo de Inversiones a hidrovía, bioceánica y gasoducto, entre otros",0,Contame una de cowoy,,https://www.facebook.com/evargaspena/posts/pfbid0SccoWLwMbjRwVeDfgkj5Pi8FsQpdQifi99HSiMSQuj8hvCh7expfcgRPshWv6buel?__cft__[0]=AZViFOJEHbUTdmFMXkuPf3ZoHTdh8GJ5S9brMT4WBQzdqygj3GWoAnA5-p5j9frlB6BB3Os0wkG_5xyo3ScHwfyFgOXTnSw7_I_nJUqc-mNaUxFEqwdB-83eSb85Inze24IjZYX8EushC4_EuPsqrBamEfGBOEhghgXV6_0wAtvIRjus1s6FhYR0zFkjYZlxiv0&__tn__=%2CO%2CP-R,5.0,NEU,0.24521873891353607,0.12422379106283188,0.6305574178695679,NEU
82,29 de mayo a las 9:01 am,"Ministro @JavierGimenezGZ, @MIC_PY, reveló esta mañana, a LPM por la 7.30 AM ABC Cardinal, Paraguay, que durante el último viaje de @SantiPenap se concretaron ""al menos"" US$ 500 millones de inversiones (Singapur y Japón)",0,"Y tenía razón Desire, se convirtió en Perifoneo del Cartismo.",1 vez compartido,https://www.facebook.com/evargaspena/posts/pfbid02gDDsqMLg5rhSnJtMyWrtVq6HZVJQBW8R1kJSisS1UXHc7uvAAqmxJeg51r4kPhznl?__cft__[0]=AZUQA0Y7wLgUNaMq9jp63b5Y4PABT8nQ8e91ChW56kCW8C9abVp-FR_YErdOkz-v2vB1Y167vwb5aw1j9uLUqnMuB9xyJvz8In8L7kHiSyqMuWD9Qs7bV9ah_tE2cxX69zjoyQOyuUzHviJcdsuALmKxnDfiRojxkEKgDPbK3JcZQMAx1Tv6lZQjv1Qnha4-Ujs&__tn__=%2CO%2CP-R,17.0,NEU,0.1655588001012802,0.16587471961975098,0.6685664653778076,NEG
83,29 de mayo a las 7:02 am,"Le digo al min @WalterGCpy, @MINNAParaguay, en la 7.30 AM ABC Cardinal, Paraguay, que denuncias de abuso infantil tienen un porcentaje elevado de falsedad porque están soportados por ley 1600, que deroga de facto el Art. 17",0,Amigo hoy metiste la pata con tu jefa hoy....,2 veces compartido,https://www.facebook.com/evargaspena/posts/pfbid027eepRrM9dPzPCJa1Y1F6yRFUqroBC9AoeXySbBQVbFty91TggqJZHDtnwge2WbgSl?__cft__[0]=AZUEzUQLINFOj8G4F9nW1D-TEbvQj3NDCBtI1xJl-lS3Pu4yW-ktcFDN1oHvXvHaaIWbAhAFf0get1qMX6xAFxZqZopHsBqFfPA9IdWh-FGFp8JQZA2EvW_BgkP5soCmx2ShuJWMT4qDp1_7fSyqa1zQhKAxOi-Wc6ABNEqmiM8MwxXl6xw9paBdQOmR6VAS7Uc&__tn__=%2CO%2CP-R,,NEG,0.018820375204086304,0.6065236330032349,0.37465599179267883,NEG
84,29 de mayo a las 6:52 am,"Ministro @WalterGCpy, @MINNAParaguay, admite, en la 7.30 AM ABC Cardinal, Paraguay, que las denuncias de abuso infantil (9 por día) no son casos confirmados y reconoce que no puden descartarse denuncias falsas. También admite que no hay datos sobre casos confirmados",0,Cuando vas a opinar sobre tu amigo Nenecho ?,,https://www.facebook.com/evargaspena/posts/pfbid02UYzbWS2BczvaDfuonMmE1UBCHrhvcJYLz3w7TYVabnDNPRhwF9hKyutncmfn6iubl?__cft__[0]=AZXOkre_pBIDcd2dcUD0QsoVknTsfQIKtLIsQeDVcWw5KNEV-zk0n7lTiX_AbUa8csnGXetl51NnovSEhp-H231w49ZHLcUl3V4ZcWI9uTUZ97-cJhhEBMfLHYYCqoEBBqRjR5XUkdZUJgYkVhd2okcWU7Ofxe3Ai7cnENkW8-g9F5rk2BR-v803RCO3oxBxZh4&__tn__=%2CO%2CP-R,,NEG,0.030765078961849213,0.5577466487884521,0.41148823499679565,NEG
85,29 de mayo a las 5:25 am,"Hola, hasta las 08:00 estoy en 7.30 AM ABC Cardinal, Paraguay. Deportes con Ariel Julian Marecos",0,Error grave..tuyo....metiste la pata con esta señora....,,https://www.facebook.com/evargaspena/videos/1183040336853194/?__cft__[0]=AZXp2WKQwYZvG7pVGxSMV-9QchT6SK0M0dgLT93Et8niTugT9bm-uEm3Xy57aBXZ_U7CYs0tKZtrMmcWDu079xVFVtc8oONnWiPBmpmcgdBz49xpkejOJZAo3u1VVtj-xzzvs73SQ8bG9Se5i3zJ8PK9wHF4g22LV3KS7Jn3y7oBxFhdJrDjysZvk77LpExvXwS18H0Ir2466b4NzoqA0cvx&__tn__=%2CO%2CP-R,,NEU,0.21240070462226868,0.031092524528503418,0.7565068006515503,NEG
86,29 de mayo a las 4:35 am,"Anoche @FelinoAmarilla explicó las expectativas que defensa de @KattyaGonzalez9 tiene sobre la Corte (@PoderJudicialPY) ahora que se integró. Después, hablamos con @hugopastore sobre las arbitrariedades de la dictadura autodenominada ""Unión Europea"" contra producción nacional",0,"Cuando le conviene, estos lo tienen claro., y que paso con otras barbaridades de la justicia?",,https://www.facebook.com/evargaspena/videos/1208150827173598/?__cft__[0]=AZUKAb6-TNYP_IHWYfzwCvBqEtXutrTAt6JvFdSChkq9Szf_tRUbEhETF_YFtfkbQSxp1RYx46L_syu1jIcLZVPwBo7Wjv5vyEYrDTLsDQkBY2S61szKEll-FVBMnS8S0iHMTu6CrajY04MxlCpP2asvS10mcXyBbGXMRHgCZ8omfQusC9xbHDVAugB6HppjUukqcMAMA94TpXa_6POJBOME&__tn__=%2CO%2CP-R,,NEG,0.04900747910141945,0.5545428991317749,0.39644965529441833,NEG
87,28 de mayo a las 9:01 pm,"A partir de las 20 horas estoy en ABCTV, en ""Mesa"", canales 19 de TigoStar y 3 de Personal tv",9,Luis Bareiro te hace 6 a 0,,https://www.facebook.com/evargaspena/videos/1380040879921781/?__cft__[0]=AZUQre7i4HxfbaowMc8XRee0Y100yckryvxh0RFAQkir2UAhpphfrIyiLfS1n4SoYEZepWGeqW7MsUptpY9SKmCQBJtWhGG3YULimZRDa7G39eniUyyR8ebVXwoZ-ZVSaXUzcnAmDyuAHZ-VgsxjUEbxqo4Hoz3Xm8AtBNejFFfeHErhGxWo0H91iHuMmvJc-NVtfSvHammkO_pkQ5OyGraB&__tn__=%2CO%2CP-R,6.0,NEU,0.15050607919692993,0.04011036828160286,0.8093835115432739,NEU
88,28 de mayo a las 7:19 pm,Muchísimas gracias por la persistente confianza de todos ustedes...que es más grande que la campañota de los fachos para cancelarme,0,Sos el Mejor Sr Vargas  Peña  exelente periodista,1 vez compartido,https://www.facebook.com/evargaspena/posts/pfbid02PMnujUTmBFdcUuZNU75U2zYQu8RzGfk9CSrh5Zx18C9xcgP2WC67bMoTELDVWQytl?__cft__[0]=AZU_k_yjHefQoPnuw_dsub_8_QQ3GfsmBreHOL_k3PvHKo1Vn1lWbtiFwbfWHW5aTwbb0-QhfA5v4SqeJf2F0J7vCbL8psT9MWylYYOWJ-83Fo1R2_srF-8pX8-3rcD7fALhSI9Y1o5JvvQ-KQ9RQVDVxy25JhxPWh5ySf3UV_liFGJ0xbJ_qkTBU0Shh-RlyCFLDe8fL2olI8GGfzX9Mbat&__tn__=%2CO%2CP-R,11.0,POS,0.5580800771713257,0.20614783465862274,0.2357720285654068,POS
89,28 de mayo a las 6:24 pm,"Desde las 17 y hasta las 19 seguimos con @figuejuanma en la 98.5 ABC FM, sólo  éxitos. @FigueJuanma hoy detrás de Guaraní",2,De anticartista a SuperCartista,,https://www.facebook.com/evargaspena/posts/pfbid02RjqKbeStdqR7PRftXwE87TewxxVW5wQXHzEGEaYDFN42viZ922CWj8b22gCkZR8sl?__cft__[0]=AZUQKrOMLbA2Img9HJVsSjNj5aiS6yTygpGX7FIJAhrY0lHllQYzqG8icGyWDuBqkC8iu46emRbF-v1KKv5WcloVlF7k7GyE2DOXBwO4HOQyV354AiAkXTtirv4_neh8wpdBlSdNceqiFYER06-EzsfXrr7A8-RM3t81YEhGmBFddo1KFybtCzebp1v27lgfMSdNi4dkfn83VXIC5_ANiK-F&__tn__=%2CO%2CP-R,25.0,POS,0.5674681663513184,0.03154527023434639,0.40098655223846436,NEG
90,28 de mayo a las 5:53 pm,Enorme @julioEnciso33...no hay que tener miedo de estos fachos de mierda que quieren legitimar la censura y menos de profesionales del lloro,0,"Tenes que ser debil y cobarde para necesitar que policías militares te consuelen porque alguien te insultó, nosotros los paraguayos tenemos libertad de insultar (no amenazar ni incitar a violencia) incluso al presidente sin consecuencia, eso es libertad",6 veces compartido,https://www.facebook.com/evargaspena/posts/pfbid02TbdBrv1Yn6sdm8E6fSf7TXThgsLWYq78euzyBe1MofeGiHesj5BtMYW3qAhrFnFvl?__cft__[0]=AZXk_4qS-CM1lsN2DeqGd5vlr3xa5rNVto7HkZnfykXxLwGBgeRs-4dK3iX_RxAjwQ6TEJm0o7g6lXVLaCDKKNNgQETU0Z_hVZtOd5LrrM54x1vP0aZnu0Ha0IJdL-86lXbr-ZFmFrHbWvMfcPXnmtrEhnOXcI2qaxYUpBW8FVRvJHk6wVUN9IK9qLPtPPneihv8A6fjCjysZVgx6o4vrDzR&__tn__=%2CO%2CP-R,2.0,NEG,0.007001034915447235,0.9617706537246704,0.031228290870785713,NEG
91,28 de mayo a las 4:38 pm,Muchos temas hoy,0,Por decir que los globalista.,3 veces compartido,https://www.facebook.com/evargaspena/videos/24253833317557487/?__cft__[0]=AZUhCyf1VMZFqpSKi3o2Zzxe3vr9LpqzKTrBccxl2tsPMAbOKx8ujSWyOFA6RAvIzrPGwrIsg4Rv2S0mstpBe2b3p4X874vKQaYaCigLLpmdLr8F_dtvG24eas71_drPkS7WJkyTNQO5rQBjC7Yggj5EeGAqriKjbNjvOxTLoPl5cIYC1-J1YqGbQesUqvpetr3gQVM9-snCqomZYcjDqKIj&__tn__=%2CO%2CP-R,,NEU,0.23402591049671173,0.19853608310222626,0.567438006401062,NEU
92,28 de mayo a las 3:10 pm,"Senador @DerlisMaidanaPy explicó esta mañana, a LPM por la 7.30 AM ABC Cardinal, Paraguay, que en @SenadoresPy se rechazará lo realizado bajo influencia del lobby de la Unión Europea en el proyecto de ley de protección de datos personales aprobado por @DiputadosPy",0,,1 vez compartido,https://www.facebook.com/evargaspena/posts/pfbid021xHt1YdoUJyy9joMJLKHxBD5iKaZDe4iro7GNK9G2sAABnyNdN5sXfdsKK3P2zKrl?__cft__[0]=AZXtdhRPzCw9_mO46y1_w1n4CNQMethMegzl3mDbcsX14_sC5WN_jzZakyVggXBkFgmlVnj-ctszMS8hR-1E_G4J2kQyxLzKclJUzxxQQq11chTe0oN2OI98NjC1aSbsnIQzT_u4ro5Qfw-FzFVber-RWuy7rEfdFgKCYFlC_L9WHSwxuH9t4AGTTqpr-CWpKIo&__tn__=%2CO%2CP-R,,NEU,0.06299746781587601,0.31320399045944214,0.6237985491752625,SIN_COMENTARIO
93,28 de mayo a las 10:59 am,,0,"Sería bueno que difundan el porque deberían de llamarte los de bancard? Siempre es lo contrario, solo cuando el usuario tiene inconvenientes es cuando llamamos",15 veces compartido,https://www.facebook.com/evargaspena/videos/592530136628051/?__cft__[0]=AZVeOjNKjmCPuaLpqP0-UPW7yucrF904dXe-kUHATIfUUZ7RGt3u7tV0Zcc7emOx3Sy1-KWEPSL4c-be05eLaRQn-mZnxz54p9PKq6Wk7JvHmiNpeJAeimleaw7J62rsdrXRYBYOqCVDH-g07u4UpkSVIlc8fCeD-uHD6z9CuhDl7zoo4spftIyy_WGLDdtryRnYOXaxNnMHHkeJL55sN6dx&__tn__=%2CO%2CP-R,,NEU,0.17293284833431244,0.35219326615333557,0.4748738706111908,NEG
94,28 de mayo a las 9:35 am,"La deshonestidad de la oposición autodenominada ""democrática"" se confirma en que no se enfoca en rebatir informes de @contraloriapy sobre la @Muni_CDE sino en satanizar/cancelar a quienes no obedecen su discurso a favor del blanqueo de @MiguelPrietoCDE",0,EVP el mejor vocero del cartismo,7 veces compartido,https://www.facebook.com/evargaspena/posts/pfbid02uzkTM5kigNriM3HVtbnNeoSYAqKzaFRtdUAJmFnfr5gGRwo9xh2BDvTX5Hne5XpUl?__cft__[0]=AZUTDipLrFxXSFirXLdBm_ULg55NblJs7CPZypVg4NSduNwOqTunE0Vyt2xRi5AMfyV7X6_3obAFzWP9rYDP5ld89Ik2u-XGWkimWx6RHKJ6hgDj8tFmgAyyx_EGR_DYUMViggLw1oIV8S2AyBzw4b0L6CcB7B3yTlFfPCXU31TA9jG6XMiIh88yZoUi-O1vPEI&__tn__=%2CO%2CP-R,30.0,NEG,0.005123512353748083,0.9320343136787415,0.06284215301275253,POS
95,28 de mayo a las 9:28 am,"Dip @FreddyFranco_py, @PLRAOficial, insistió esta mañana, en LPM por la 7.30 AM ABC Cardinal, Paraguay, en que investigación de @contraloriapy a la @Muni_CDE le parece ""maniobra política"" pero que si se confirman en @DiputadosPy las irregularidades, votará por intervención",0,Cualquier cosa ya son los del PLRA menos Liberal !!!,,https://www.facebook.com/evargaspena/posts/pfbid02mU2bEzofAaF4xsuWXADW4XcYb4e2vBaKyRdVpjiknxGEap1yhLxce5si6GN6XpB4l?__cft__[0]=AZUHZZZy5qZR6fGLr7SoKitvKgfpnbUcRIx9YZLc5jNrzz5dK-6xcBC198uRuF6n7yq6v5AhOzaxHey0P1PGAN8PFBZKyNWsJAPVqhw7QNqf4_rk1h_XFOPv6BenArXAFrk3Gf_hQbOigzWSjNZsFkDejpsgCfm4IgmnVLcPwnUgAxZ4rCFW_ZjL6jEFRZ0MGDc&__tn__=%2CO%2CP-R,,NEU,0.04022231325507164,0.31791114807128906,0.6418665051460266,NEG
96,28 de mayo a las 5:27 am,"Hola, hasta las 08:00 estoy en 7.30 AM ABC Cardinal, Paraguay. Deportes con Ariel Julian Marecos",0,,,https://www.facebook.com/evargaspena/videos/1467792284599279/?__cft__[0]=AZVhx57eR172QLuZh2UWWePpoSS8nBK1RxAmmSfEmb_YPSkyo9yYik2IK28BSANvmu45e8VH1Erc1b0tEo5FBWdlPV2HfMuWWGXf7YNuJ8hTwJaAkZqDntddMo_vjiwgU8GEHoIXF9J_0a8MUEoo-qsFoRSk_jD_I-_M4D0u6CiOvJf1ucrM9YO08unMxnUFTezwU2or1IA3xc0S7MZ6LOeD&__tn__=%2CO%2CP-R,,NEU,0.21240070462226868,0.031092524528503418,0.7565068006515503,SIN_COMENTARIO
97,28 de mayo a las 4:08 am,"Anoche hablamos con los doctores Andrea Ojeda, directora @vigisaludpy y Jose Ortellado, vicemin @msaludpy, sobre por que Paraguay no aprobó el tratado pandémico de la @WHO. Esta semana se estudiará vacuna covid para niños, retirada por EEUU de la recomendación",0,,19 veces compartido,https://www.facebook.com/evargaspena/videos/714113060983569/?__cft__[0]=AZWNIz6rY6nHnkDNDdqSE4b28QMwaZ28UuDhTFliW8dGkLUhQNXCWy2KxMMTbg7A1E6hbJVEn83yLUGWW4ypjXW1i7o5MvrX06L1iJLlnvmiDCsLT1TxqxWAcdeb20CduWjHcBDyv5JzO8TYoaZCcyXG8F5Iq1bM5zmZ4f9S-T9AcnrspVIZe4X8z-VWufVj92yf_RppiCKhN4jKghHSd-WN&__tn__=%2CO%2CP-R,,NEU,0.020794622600078583,0.47986918687820435,0.49933624267578125,SIN_COMENTARIO
98,27 de mayo a las 7:59 pm,"A partir de las 20 horas estoy en ABCTV, en ""Mesa"", canales 19 de TigoStar y 3 de Personal tv",0,Yo no entiendo para que invita si al final el nomas tiene razón ja ja  y también eso que asisten como invitado no entiendo para que van si al final ni le dejan explicar nada osea al pedo van ja ja habla habla como si fuera el es El Salvador del mundo j…,,https://www.facebook.com/evargaspena/videos/3034861383355435/?__cft__[0]=AZUruaEZv28YSe7Hrtlo0R1FdwwinchKyj-oT7-EEgw9rGc05U-dZ7kUKHPt0MwSENd9rB3wpTmGAFsG_ZvZfd8H6pOoyIWVD_h9SrHJ1f1Rbxb3EYuFfgi2sg1jhIlbMn8aRIa6hT0rYb4Hsw6k1aCM50JTcfQhnR7HoFGsjO-9ystWCDvwFTr9VucgnWKUJYVpuGcdWZDxrUgGGdXjgQ0M&__tn__=%2CO%2CP-R,,NEU,0.15050607919692993,0.04011036828160286,0.8093835115432739,NEG
99,27 de mayo a las 7:17 pm,"Como me olvidé totalmente de hacer la foto...tal vez porque llegué bajo lluvia torrencial...recuerdo nomás ahora que desde las 17 y hasta las 19 siempre estamos con @figuejuanma en la 98.5 ABC FM, sólo  éxitos",0,,,https://www.facebook.com/evargaspena/posts/pfbid02QVknP7xjkdeL1Uq9ZLctXSDik5PTh2dFzAsx2L3drXGhG4DrCDifPfZHbZep918Tl?__cft__[0]=AZU3U1gC_Sd4Z2f9Beg6OOeJAm390zecdTHPXatbzxp2T9-3iF2UFos94jyLcxXanvxpZS_4tiQZoyx1NSbZ6GlET0_LQwcGZXzgl9KTAsyiQd_VuuV4knywKwe1-xRUckvLAHbc1qJ3n8E0EzuPMUe8j29EiP7YjHcZ4w3qAfjGUW6CbXAqMou__-ZOdw41kvs&__tn__=%2CO%2CP-R,,NEU,0.15579138696193695,0.027048645541071892,0.81715989112854,SIN_COMENTARIO
100,27 de mayo a las 4:17 pm,Comentarios ante cambios en las posiciones sobre transparencia,0,El Nuevo Papá dice alejense de los que se Victimizan jaja,7 veces compartido,https://www.facebook.com/evargaspena/videos/2106810126480846/?__cft__[0]=AZWDIIQB0tV27SKccprPyGtTPKJ5jhqJtEJ0EUHU6qq9yE-HRnMMs39U_Z6NaRiRIy5c5DJZBxwH7W8wzt3Zv1gv9wzOurFEQrUHIhlA-FmOa1tyR5T0EdfYkaRvmlOU9C6tHp0nDH7bOrSnsOtRp966EDZe3086zY0hEw1af6zh39Uj3xzPXdgxsG8c53Uz4BTCdRX4Hn6BKeVXKILh6Y4a&__tn__=%2CO%2CP-R,,NEU,0.07134715467691422,0.14614374935626984,0.7825090289115906,NEU
101,27 de mayo a las 4:03 pm,"Dip @cerini_py explicó esta mañana, en LPM por la 7.30 AM ABC Cardinal, Paraguay, que defensores de @MiguelPrietoCDE pretenden ocultar que informe de @contraloriapy sobre @Muni_CDE muestra, entre otras cosas, que @Muni_CDE sólo presentó 10% de documentación que le fue requerida",0,"Que persecución más terrible, hasta EVP, le hace el juego a estos cartistas, que no quieren contrario, les irá sacando de la carrera a como de lugar!!!",1 vez compartido,https://www.facebook.com/evargaspena/posts/pfbid05i4JntUa59m8br7FBcuLX4DpSLmFtU8gXnQT41hLYMThjRxu7HhiMGRLnyjyNGiJl?__cft__[0]=AZUz3T57Af1EbsgDwZNPNuq3nGV70jiyohe0Hs37UpAUAVM2Qm7zD6tYrxOU9qpZJXu-vSUxmeJ8krwXuWX6PEfYs5LdSzJj0db7xn5uCxcuU7xGEltQ-dsZMDHqG8LQpPWYJIwUFIWzFNjF_xzO4eYzSuhoSpc1uGXGHIzJP42ixNa8LmKB_aMKOvV6y2yi43k&__tn__=%2CO%2CP-R,10.0,NEG,0.016782250255346298,0.5810151696205139,0.4022025763988495,NEG
102,27 de mayo a las 12:21 pm,"Anoche, con diputados de ""Yo Creo"" @leidygaleanopy y Guillermo Rodríguez sobre si defensa de @MiguelPrietoCDE, líder de ""Yo Creo"", repite o no los métodos cartistas de blanqueo de los suyos o el ""chancho de nuestro chiquero"" de los liberales",2,"Insoportable es este sr usó un video de otro canal para descalificarle a Prieto, no se como sigue en abc",2 veces compartido,https://www.facebook.com/evargaspena/videos/1387878442471263/?__cft__[0]=AZXz81rSMWCJA6N4jCescHOgt6benHoWRIdnJvvvQZRKxrcnYUmmagJEK2uQAfZTmRDBn3UpDsMjMv7wUo_dUWJy9DsHSpwvGmagAaZB3M0_RFA5vtxmEU7tarPXwuopZ7LJAVTt-1lZnn7sdAyZ5Ta3kJpaciEUcCCyl9quOs_ma2ZdqpcNyaa_pSEN4bU3MhI3QGm2-cn8pa_5f0oDgBru&__tn__=%2CO%2CP-R,4.0,NEU,0.02453949674963951,0.46415096521377563,0.5113095045089722,NEG
103,27 de mayo a las 7:44 am,"Comisario Osvaldo Aquino, Investigaciones @policia_py, estima, en la 7.30 AM ABC Cardinal, Paraguay, que asalto a empresario Claudio Centurión en O´Leary y Gral Diaz fue pleaneado por gente con pleno conocimiento de todos los movimientos físicos y financieros de la víctima",0,Vamo a estar mejor,1 vez compartido,https://www.facebook.com/evargaspena/posts/pfbid0x7W966yZbfwsyasJrVaXCfpQ1xasgSYx5LMWsKBVPCcte9ebzoinnUMRHfY1933ml?__cft__[0]=AZWp4NR6g4TuSUOWQ_c-npxpASz_P3DGgObbQbJWMDfGb_tKf8Sk_FVk2k4tiplsxn4JB98jcPEvzs-miUMohnrLMBhNLiptXj7XSvU4o-E-oAMTbXnoLJ1FDOUK9mtWe87QrFDl9ggRFPvhPLVsI_SaXWXX3hubtxxfKsLlH40CnxRjkEPOFu-xDy3i26aAeRA&__tn__=%2CO%2CP-R,,NEU,0.0895075723528862,0.28093257546424866,0.6295598745346069,POS
104,27 de mayo a las 5:34 am,"Hola, hasta las 08:00 estoy en 7.30 AM ABC Cardinal, Paraguay. Deportes con Ariel Julian Marecos",0,,,https://www.facebook.com/evargaspena/videos/1259003182893768/?__cft__[0]=AZXPE3j8tnZgnTgU90CVKdY3hCaksNsqXW8z9F3J0t-UJr79hMMJGiyF6-rIg7nQh9UkwvVkZt76kENdgp0gW6RC6erQvD2nIcRAMf1gPsTJ1SODNUiAy4CclBrERjcZWN89SgelFXXe1dHL6mRiNdMGj5OdZxlCs03OG3qzSkFBRqiYZFrjbfWcWbPMqCkbkY_ra3wIL9ut-e5b7HgJJ6n1&__tn__=%2CO%2CP-R,,NEU,0.21240070462226868,0.031092524528503418,0.7565068006515503,SIN_COMENTARIO
105,26 de mayo a las 7:12 pm,"Los cipayos hediondos que reptan para complacer a los fachos del Foro Económico Mundial y a su brazo, la dictadura autodenominada Unión Europea, llevan algún tiempo pretendiendo imponer censura. Les contrapongo a Thomas Jefferson, mierda de payasos:",0,O sea que el Romano Pontífice es Thomas Jefferson...,2 veces compartido,https://www.facebook.com/evargaspena/posts/pfbid0YVu7LSqxv6rvm7Zy3vyCcG3G2735sDYP1r84DXgsJX8fbvviygJyjGmERQLNtgBFl?__cft__[0]=AZVe9wqaL8sEeKGGf6Pxt1ikDbr-vhNeb4QIgahAgZborVzcuLpeSx8ob7YLXwy3OLoOfkgTnZXd9BK15HnRcvTBLDtS1MHClIsp5jt_GFH9ajVU0OMxVV9Upt3vUB7HuuS6aLmH_fY3Fbk_exxn28ke8c6GifHTyYZgRCsyEtRj6RXW6YlqchOmKs-ULDSeKSNue6lQCWnngRfBTKCOEoh4&__tn__=%2CO%2CP-R,,NEG,0.006718036253005266,0.956387996673584,0.036893971264362335,NEU
106,26 de mayo a las 5:43 pm,"Ya volvió @FigueJuanma!!! Acordate que desde las 17 y hasta las 19 seguimos con @figuejuanma en la 98.5 ABC FM, sólo  éxitos",0,La dentadura no se toca,,https://www.facebook.com/evargaspena/posts/pfbid02Q8MFvAPoxH6aRWNDmGvaEVEs7xDpjq1yt2xeStyyuPPuC3N2iZpGjVp8wVdrHNQMl?__cft__[0]=AZVHfKtF85tSjcva8KlTgis2_IHr3TpCN3nmkxqEPiyG6zxj6fkxQsxEEUeX09XANjGXWaQVEHEo7BNj7e0-oTaKlhm2Wd1x4QbcTj_ZAGAafFVND3zFcmQkrgAVeQLiuBI1vL2FReIZa_RgOEFM3PlMY-ASml5n0XJglIAzri9qU7bCO7PIR9xlQ3k2rsyd1Jw4PcW2jG1WFCKiEEZMRtpq&__tn__=%2CO%2CP-R,,POS,0.5302572250366211,0.033071331679821014,0.43667149543762207,NEU
107,26 de mayo a las 4:25 pm,Los sucesos que hicieron la mañana,0,Se oye bien?,7 veces compartido,https://www.facebook.com/evargaspena/videos/1026332746349700/?__cft__[0]=AZX8k8O-sm_ePHvqdkdyKlUFxUh_zOCI4dlHNB7UNRqaQO_m8YlkmDwy2Wnd7mabhqdOqQUtdR2_Lf5en5VSWc6UO_7mvspnjIAp1IauspPMYs7BRb-3NkV0PvnecIroW9M3UFj17q11JNKuVARhtSBvBuidZCvIQxnELmlMFM6nE5xEWNWcFVJvf6O_stXufZA0AOK7-UM81OkfJ_BppzUa&__tn__=%2CO%2CP-R,,POS,0.9068558812141418,0.006613145116716623,0.08653099834918976,NEU
108,26 de mayo a las 7:24 am,"Senador @OviedoSenador reitera, en la 7.30 AM ABC Cardinal, Paraguay, que su principal asesor técnico, y el de la oposición, es Luis Benítez y que su enfoque es incorporar el sistema electoral al esquema de ciberseguridad que Luis impulsa",0,,,https://www.facebook.com/evargaspena/posts/pfbid02PcY3r4zSLzxbjEiCYTqi5kBNb7repE7EpVF7dcCk1BkAfp8R5XD91PdnkGHBimF6l?__cft__[0]=AZVqZNZZ-DvC8KZSPYNkFNdw4mFEVzgrbcnRqpsujxZO2KoOfWWNA1jdbONGvs9cXcYgxdqxSGBukXXkgb2cmrZ-FZM8Qjq_GqCJ5fQsYe58XhxOcHzelbCdXXL7FKfmRLJUGRgZ1dXwHcfZJqwWbeb0L9GPI80WA-XFm45oZOfVDKEQtXvo1WbYZd76RvMe9xs&__tn__=%2CO%2CP-R,,NEU,0.25836285948753357,0.09828576445579529,0.6433513760566711,SIN_COMENTARIO
109,26 de mayo a las 6:44 am,"Senador @OviedoSenador admite, en la 7.30 AM ABC Cardinal, Paraguay, que en 2023 no tuvieron (en Cruzada Nacional en donde militaba entonces) ninguna prueba de fraude y confirma que ahora trabajaran desde @SenadoresPy con el @TSJE_Py para aumentar seguridad de máquinas de voto",0,"Obviamente no hay pruebas si nunca permitieron auditar las máquinas ni se abrió el 4to sobre y se llevaron alas corridas las evidencias, pero como dijo Juan Gabriel en una entrevista cuando le preguntaron si era gay "" Lo que se sabe no se pregunta""",1 vez compartido,https://www.facebook.com/evargaspena/posts/pfbid0c5WQ3ibXkBWZcW5i683U6BuFbdEVjmPSJDCtmLfZM47M8dYuxRB1Yi7d66K52jrwl?__cft__[0]=AZWD2qPb373RRw73doqhl867xTlps7eL5DhyniqP4igbFarkJKfyvFmYREdD5GWlvIHdVqDmGTlJYwfZ3mVbUYX5hcGC8WDkm5ps-UW53hNQJ5YjKOIHSFSRcfszJjLIdnytTVngKwWXbwuDIYxm1dkqf77rmIxLT9Mta7pe7-P5_2imbVymbqmsxB5ReEqqTEE&__tn__=%2CO%2CP-R,9.0,NEU,0.05495213344693184,0.21247224509716034,0.7325756549835205,NEG
110,26 de mayo a las 5:30 am,"Hola, hasta las 08:00 estoy en 7.30 AM ABC Cardinal, Paraguay. Deportes con Ariel Julian Marecos",0,Koreee nde tuja planillero Hc Rymba jagua tuja,,https://www.facebook.com/evargaspena/videos/881770597455742/?__cft__[0]=AZUxxgwHlp6rv3HJuZ-WpLwDfwDxF2Cf_y6QLMlrq-03LiSAhGEXTHPyzHyFUox9CMiBq8ZbJdsMGwfCMvpkJYH36qqvbcf3DwfFTD0X6kTzOJl3SwfIptKIo4J1sW97ZBFJN8a_kw7AotOfEVhoTMo5JtSrumDBOSpw2hjKQm7qYUeNo0BOCGdgF0vJJwNo7TXGUuzd4ANG1g8ctvk_ndB4&__tn__=%2CO%2CP-R,,NEU,0.21240070462226868,0.031092524528503418,0.7565068006515503,NEU
111,26 de mayo a las 4:28 am,"El viernes 23 el senador @EverVillalba_Py, @PLRAOficial, confirmó que su opción preferencial es volver al voto sin máquinas de votación. @EFSantagada explicó acción judicial a favor de ongs",0,"Itavyma este, menos mal que se cree liberal !!",1 vez compartido,https://www.facebook.com/evargaspena/videos/1258515519049100/?__cft__[0]=AZXoX3UMhmJ2DMbniS4kMr9nV2IUynBfiep0qg_f94zMTGBKa0lB8MiJoT8adU6FAmMxf783DPeMM0gJowws9d1Rinfi_PUdjMr46xZVToN3cHftGM0-Lp3AKVT7tBUgyTx25mxG4TrsMeBL6ETcgIaGVdhsAAvkTpWJELj_PqOnAmclN20y7VwNUrhSeXGIKgWf8NovmyTENZkKEEyV1K6_&__tn__=%2CO%2CP-R,,NEU,0.06404204666614532,0.20924179255962372,0.726716160774231,NEG
