id,fecha_aproximada,contenido,cantidad_respuestas_aprox,comentarios_usuarios,compartidos,enlace,reacciones,sentimiento_contenido,prob_POS_contenido,prob_NEG_contenido,prob_NEU_contenido,sentimiento_comentarios
38,5 de junio a las 6:45 am,"Presidente de Consejo Salario Mínimo, Enrique Galeano, @MTESS_PY, admite, en la 7.30 AM ABC Cardinal, Paraguay, que subir el salario mínimo en julio perjudicará a alrededor del 90% (""efecto rebote"") y admite que computan como ""salario mínimo"" a los contratos de tiempo variable",0,Y adonde están las centrales obrera de nuestro país para estos casos que lo primero que tenía que presentar las protestas a favor de los trabajadores desaparecieron todos de la mapa,1 vez compartido,https://www.facebook.com/evargaspena/posts/pfbid02YoYSp2kGbqPdWFmsNkMuAdZ9iDLQUL5XLFaEa6ukBYv8gjTzX7ZbCRANNb8ppHcl?__cft__[0]=AZUt1ZEgNYUrQu_D-TkX_co_Q1LL7tHFwtAoj-g4KKSpDe7kNUzxkprWVsGwXPC65c9U2Xkl8c0fGYcBMWGEl7bCz3keUYtX66k_C9snG-5cpMs_gW3VToIVOP10soLnquASRpVKIOPjCchoVbTbxisy8snHgvpTY7iHzQMnpZc7MrhXjGCU8TvvFE-Jx6N-B-k&__tn__=%2CO%2CP-R,,NEU,0.0397828035056591,0.3437720835208893,0.6164451241493225,NEG
39,5 de junio a las 5:21 am,"Hola, hasta las 08:00 estoy en 7.30 AM ABC Cardinal, Paraguay. Deportes con Ariel Julian Marecos",0,,,https://www.facebook.com/evargaspena/videos/703689059199687/?__cft__[0]=AZXX3mdnhn_Ft4QJpR9DRW3-D1lB9TW6Y_KRVh37jjdTpuphX2RwFIcBGg7HGcHMVMTo11nhdFmQxzNyPTwlVOl14qlpy-IwKFm-7gWto7WOMJdrPTeLUU5mPlqb-lRhxmaHrCGC5anEs8jjRabcMifbu0lz0YWWWzNWBmQTSkn5GQq8OLLQ-w_bpTz37t1KJjzMaua26olaOPNc9DUzwNkv&__tn__=%2CO%2CP-R,,NEU,0.21240070462226868,0.031092524528503418,0.7565068006515503,SIN_COMENTARIO
40,5 de junio a las 3:46 am,"Anoche hablamos con @bachinunezpy, presidente del Congreso y de @SenadoresPy, sobre recusación de dos integrantes de la Corte (@PoderJudicialPY) en el caso @KattyaGonzalez9 y con el senador @DerlisMaidanaPy sobre ley de búsqueda de desaparecidos",0,,,https://www.facebook.com/evargaspena/videos/1639993223345441/?__cft__[0]=AZVa-JpxYi2JWk9aN5szfLTquuCgWS8dayau02DfL32V-P7TRJcjILokyVBvrzXxg_sw-GrhyEC7uUDDQzqcTabwuzbMfnybBKpU_dFyna-5iN4RiF9KRaZqKxRBU_X2fgKwOgKK7277tgpcCKSMQv7Tn3JNwogabCXFhLxS-xk0FrCLfPJrHy0dgv7bYQn2qfrYFNwTBjGiqgAjUKNRmH65&__tn__=%2CO%2CP-R,,NEU,0.12170249223709106,0.24479064345359802,0.6335068345069885,SIN_COMENTARIO
41,4 de junio a las 8:03 pm,"A partir de las 20 horas estoy en ABCTV, en ""Mesa"", canales 19 de TigoStar y 3 de Personal tv. Mañana hay fútbol y no ""Mesa"", aviso ya",0,"Uno de tus  jefes, pobre infeliz",,https://www.facebook.com/evargaspena/videos/688026717352570/?__cft__[0]=AZWrQoMvdBXY5R43I8fnDSbzqjSQ0LmEPfoGmBg9ij0wxwKxi1ntL7XvU79xwk9NEJgoU1Anw2hGd74NIcsifQ1fWJ4Csx_voRPjUQkNEJCognqsqZYoEYWCap_azVqcdd7r-teoqlFm-BQ9Y_hOqWkFa7BV6VbjpgG9QeL9uaJcEg51DYZeMB4G3--6yrHlN7nQCp3z4JPvOwtDZOMRKDtQ&__tn__=%2CO%2CP-R,,NEU,0.10831589996814728,0.05005756765604019,0.8416264653205872,NEG
42,4 de junio a las 7:21 pm,Los crsitianos empezaron a matarse entre ellos muy temprano. Los demás creyeron que era una debilidad. Sin embargo era signo de la poderosa vitalidad interna que les permitió conquistar el mundo,0,"Que pena la gente no entiende que Dios ama a TODOS sus hijos!! Dejemos el fanatismo a un lado!! El Dios de Jesús es el Dios de todos aquellos que deseamos seguirlo, y como un Padre Misericordioso no hace diferencias, respeta nuestra libertad!!!!",1 vez compartido,https://www.facebook.com/evargaspena/posts/pfbid0sLKyXjTZPrpQvbe9R99pr7ztGRuSSKNPXUcsZ19owUZaByLo7zZ36Kqzix2VwF8Wl?__cft__[0]=AZUBColwd_VFl46RJKfk-9wHWkgdpN5H3154hXuQKjLKSsHG3vmcdg3FZua6tNzMcSALjVNP_EAS8Dvj38MN-mmabUp0HDEnq9CpRxihU9OPXDWSadhco2YarAHJso0fsN1AkFw7hJW7YAsGIHhanTqDA2Ogggol3hMAK_SlIvfKMSJ_Cqyh-K4IC1RLhIM8B3M&__tn__=%2CO%2CP-R,3.0,POS,0.46551209688186646,0.0889357328414917,0.4455522298812866,NEG
43,4 de junio a las 5:44 pm,"Desde las 17 y hasta las 19 seguimos con @figuejuanma en la 98.5 ABC FM, sólo  éxitos",0,"Juanma , duro trabajo tenes",,https://www.facebook.com/evargaspena/posts/pfbid0gwbbqD5PitYqB3SDhKbqX6utDNVQHYyoRD6kGFk1FSsDZ7b9YAB6w21nzA7b3ZL3l?__cft__[0]=AZW1wPKAehM1p9KR5lUqM74-fVPcahIWtFm71J4_ilFlhn8C77eMeMSFF4oAaDD_GFp2UZYZaY4a-Od8J3JGutyJPB_UYm20wsdKoS6qLhxDhxvEM6eO7buLDlPd0Co_ZxhAlut2BFsSvWSRl3BzkjI_pbYMPhlXgpmL_TYN3NY62J7RFq0ffstrYbu1ZYjSf9doP1NK_KR62BO_3QotdE_V&__tn__=%2CO%2CP-R,,POS,0.48317578434944153,0.039908383041620255,0.4769159257411957,NEG
44,4 de junio a las 3:53 pm,Novedades políticas importantes,0,Nos enchufaron leyes wooke desde el 92,6 veces compartido,https://www.facebook.com/evargaspena/videos/1388267402457370/?__cft__[0]=AZUUkdqQM4iHf9jFCiqhjCPnogae7GbleTgNfX5v8ehVJj0NhU0JOXNORZg-IO2fvlXVBm48SefYyoklBBuNHZc_HJ8CHA-HeFfYo52rojHoYjvvc22hn48kr7BZBfXJrdpId3a-YF5hLBPqhR6LrOJ5rwLtYGcMtRVdYodFOD8EU77TcdzvCrXiHelEMZbzJ076MaEnj93Adu3sAUyJXc42&__tn__=%2CO%2CP-R,,NEU,0.4338667392730713,0.04797108471393585,0.5181620717048645,NEG
45,4 de junio a las 7:53 am,"Fiscal Fermín Segovia, caso Fernanda Benítez, confirma además, en la 7.30 AM ABC Cardinal, Paraguay, que hay indicios que muestran que supuesto victimario ya había incurrido antes en conductas similares a las que se repitieron con Fernanda",3,35 años de cárcel más 10 años de seguridad,2 veces compartido,https://www.facebook.com/evargaspena/posts/pfbid01D9xhx463DfnZbD66Kqvxvg89j4vJUTdR8p9DRNpsDRY6niFPDLqBtTjoGzH9bUkl?__cft__[0]=AZUKz4wTfn8YrFcOMpEm5oNTuBgb3se6MbjRDR6i7wOpYmFf7Zybk-O059pEIdlQnEhJnkEcP00T3eSofsAnvcbiCT5lsCTO6Dpcg-tn2mZOTbOoE-0QicBwc-b2g1bFE14tRROws5YaWOpGJj-5IkTWjb0TeWNBZN3FtC59vZXPbW66clEa4-zGa6i4ONzuQfU&__tn__=%2CO%2CP-R,6.0,NEU,0.04828191548585892,0.3652716875076294,0.5864464640617371,NEU
46,4 de junio a las 7:50 am,Hora astronómica: La que surge de la observación de los solsticios de invierno y verano,0,Calladitos los que pensaban que con el reloj podrian manejar los fenómenos naturales!!,2 veces compartido,https://www.facebook.com/evargaspena/posts/pfbid033m2JegXWMAWiXJWg86kLD4hXYWWntNCavK7LLQFuJ9P4JjVDsHKUPSttMz2MLkpdl?__cft__[0]=AZWVuXhBCylf910GKU42yOHqH_YLVBgqx14bK4W9jxCAnEhklC5_0wsXa_ufsBR_v4Aa0PhtDzz607HN0CBT_Orq03WXugudCq6tjDCPZUPsopyUCPfJvDUeHb_9gi2qn0JKL28w5GtvithlNTEkZaOAjPCy676k8mZA-C8HgELdsvlglj2qFKn7u38gkPjuBCE&__tn__=%2CO%2CP-R,2.0,NEU,0.15266944468021393,0.030752677470445633,0.8165778517723083,NEG
47,4 de junio a las 7:41 am,"Fiscal Fermín Segovia, caso Fernanda Benítez, confirma, en la 7.30 AM ABC Cardinal, Paraguay, que tienen ya evidencias técnicas acerca de que Fernanda llegó con vida a casa de los padres de su supuesto victimario. Explica que calificación de ""feminicidio"" es provisoria",0,"Enrique te estuve escuchando y tenes toda la razón, el tipo penal al que se adecua la conducta es el de homicidio doloso y no feminicidio",3 veces compartido,https://www.facebook.com/evargaspena/posts/pfbid0ZQyYpBHXwaK3PfCTXbXQ35z5bkgNfkrD3ytMVSmHCeQyinTGhFyke3sKbSVKwaRyl?__cft__[0]=AZXMVyxHKIXy3JDc923iS1poGomHbsSrXTtW_PxMw1CW9FgyhmJjenZIs37Kfk3YtjSPK04C3DoFR8X4RNvtE0bfkXISXp8F_ReEBDGzor7hv6uuXLQItSOzfvYqmtddaLXxYR7vQD2TE149XTiMdaLh7mfKELjZBxW47ryQeYpYNMFvEppO_IZkyRmMzvlL1p0&__tn__=%2CO%2CP-R,7.0,NEU,0.04456508904695511,0.38494762778282166,0.5704872608184814,NEU
48,4 de junio a las 7:18 am,Vuelvan a la hora astronómica CARAJO!!,0,"Este horario es genial, cuestión de acostumbrarse nada más. Ahora cuesta, el próximo año nos vamos a quejar de otro tema",1 vez compartido,https://www.facebook.com/evargaspena/posts/pfbid0212n8SEpEaA8B4qjvWM9kgtHe7hbgWsKP6DDyH3Nvp46g8RJunJcAehmfWgUY4x9rl?__cft__[0]=AZWqZmjPsqZAiNEshN4nl9RFxyISQ0zDcCgMpROXbZ1vF59uCtq1L4kpJU3-UCY0TjxtoJf5pNyTgoJ6hHXMFDk-V8AVH9VSXB9hqAi6QW-YQyga3Rhwc3_MTEMw9vwkSiBegBw7xTOdAMRP22pN7Nebb7kwt53jiN_c1_If2UIHhmZ1rekrxCgdZgyZscyYcgpC8D-f35pY02B0oj7hp44j&__tn__=%2CO%2CP-R,13.0,NEU,0.3511751592159271,0.16440589725971222,0.4844188690185547,NEU
49,4 de junio a las 7:14 am,"Diputado @JorgeAvalosDip sostiene, en la 7.30 AM ABC Cardinal, Paraguay, que @contraloriapy tiene facultad para solicitar a Poder Ejecutivo intervención de municipios de acuerdo a Art. 165 inc 3 de nuestra Constitución. Recuerda que él fue por años funcionario de @contraloriapy",0,,,https://www.facebook.com/evargaspena/posts/pfbid0cMnC5v3x5AE1oGkCUKy9FzZfpeYvaW4HtrVc8nhSWWTLFNcTdQP91keT3FDVEXdil?__cft__[0]=AZURUpwCHheA96Ew6igTSmDgfPNVW6FyfSI2l5ok6-xRyw5fp1aiq1dgYnoVkaQlRTPaQnvt9nMYl35BlK8HJTcDhNktp3RXMR3sikqLP1SHldlNlgkBBsnM-6vP3QrjTHL9nDzLJ9X4qzGXRey8TXPUWft-qCdZEBXLdndNAZmiOEJuFhVs3OMcEyszhFElo5Q&__tn__=%2CO%2CP-R,,NEU,0.0902041345834732,0.14347931742668152,0.7663165926933289,SIN_COMENTARIO
50,4 de junio a las 7:03 am,"Diputado @JorgeAvalosDip reafirma, en la 7.30 AM ABC Cardinal, Paraguay, su acuerdo con @RocioVallejoA en los beneficios de participar en comisión de @DiputadosPy para intervenir la @AsuncionMuni pero se niega a criticar a sus correligionarios que boicotearon a la comisión",0,,,https://www.facebook.com/evargaspena/posts/pfbid0H5uV8eDy84psK4pr745gGwR8aHgfXudWA65fYAq6gcJJocoWPzsvFBNkuqcutLhil?__cft__[0]=AZUpLtF3gOGo_yO9i0ZxYwNesQvI2e7vT6yrz67ZD37JndaPIvMYWAlBysoL0Y-bLtg95lWDHu0HnWyIvgG_u6jXrVf8cG2yTFy3FgE8GLgdat4XvuYJBEBxjAtfk0vx33blYcvIbnu1nkLRUga7nLmA23DUlTKfqppfFsQPMFU6bJHS4fwU9mD40jVmkKieJxA&__tn__=%2CO%2CP-R,,NEU,0.06177939474582672,0.36835160851478577,0.5698689818382263,SIN_COMENTARIO
51,4 de junio a las 5:24 am,"Hola, hasta las 08:00 estoy en 7.30 AM ABC Cardinal, Paraguay. Deportes con Ariel Julian Marecos",12,No es estudiante de medicina. Estás inventando. Ni siquiera empezó la carrera. Dijo lo que todos sabemos de ver tele,13 veces compartido,https://www.facebook.com/evargaspena/videos/717324687476953/?__cft__[0]=AZVlhqmLDJ55KvcZkF0c1QWsGxVGGLeIp0Vk2JlKOt9B2dJNrIkLun8RpArY9SFAEMhE8_bsnWqRYDk2KsRHjNpZi4QdaX5J0GoC7poxx87D-Oa58uhe-m9Z_PqjLeJR2DDYvN1-B0Tn0RayXMQWs9czujFEJT2VvmrM8-uio6p64ASpon1eGLL-yggMRcSEJqVXE0Ni5WYrPGymNzbMNcQe&__tn__=%2CO%2CP-R,10.0,NEU,0.21240070462226868,0.031092524528503418,0.7565068006515503,NEG
52,4 de junio a las 4:10 am,"Anoche hablamos con @oscartuma sobre imputabilidad de adolescentes, caso de Fernanda. No sé por qué cortaron lo hablado de inconstitucional ley 5777. El senador @zacariasirun al final no nos atendió sobre búsqueda de desaparecidos. Ministro Jalil Rachid, @Senad_py, sobre Marset",0,Ya nomas se debe analizar y salir del tratado y convenio internacional. Y plantear una ley acorde a la realidad paraguaya. El Paraguay es libre e independiente!,1 vez compartido,https://www.facebook.com/evargaspena/videos/678434064961458/?__cft__[0]=AZX3Ukr6KeevydFRYHm-4snhFa10ZJ6MLAEZtp_TP_n7XhWPQCKakhYrER8xbfKq5u-_YIeiO_k7boV1RCZeI7A6hiKZvfVsp0h7mn2zlgvwt64_s47DpCe5uwXqmi6pJVKIx6ENuS8wX9QzmqDY2NIoAnUOJw2TMrQL8afjSTKBrAkgGUZT71mmf0O8oIGZATzeelQgWu6K-HbWstG0GSWl&__tn__=%2CO%2CP-R,2.0,NEG,0.006581062451004982,0.8517425656318665,0.1416764110326767,NEU
53,3 de junio a las 7:53 pm,"A partir de las 20 horas estoy en ABCTV, en ""Mesa"", canales 19 de TigoStar y 3 de Personal tv",0,Vargas peña me pregunto por qué estás callado ante este problema grave sobre Control facial eso es para completo control de los globalistas aún estando en tu cajón te harán la métrica facial para detectarte y para saber que estás sentado en tu casa o e…,1 vez compartido,https://www.facebook.com/evargaspena/videos/710433445278399/?__cft__[0]=AZVCHP6j6n_WZ8JdetBy2vXXU3yStNPUVpcfadCMMNdH_MIz5RycuQOYhUhG1QwM2uxbSKojAdlD7bc0kjK5lWR2G7kVODXG1FPlx2TqkF95Xjq4bnW9Mxe6ILf_GkW7mBwjQBpzkMOD9IlENjZGye12PWYulKj3emLz9K85b84sBfRBMtiBAVmZTrid3OlB2ed3ag0DaM51dbsEqpY1ig9X&__tn__=%2CO%2CP-R,,NEU,0.15050607919692993,0.04011036828160286,0.8093835115432739,NEG
54,3 de junio a las 6:24 pm,"Desde las 17 y hasta las 19 seguimos con @figuejuanma en la 98.5 ABC FM, sólo  éxitos",0,Na apenas pende enrique,,https://www.facebook.com/evargaspena/posts/pfbid0JhcC9J9VpnfYZ6aodkBDKgKBtpcXTrLZsEnGnP3s2NqZviGKEgPEDcieeK7c8LVEl?__cft__[0]=AZUbAy-mzK4G94DqxMJlat0U7C_YHSeQyzC6KqXSC2qK9tQtJwU2o-yUbmRIxUjK9vwploOC5u4hppvujzdZ45KiT-ZTK-Onfxp81qh8360R8fDQn2VWSGQEaAw9guGplw4YdGLuxsR7cjnCrMA3GR3HKsPp5bWexpnAvU0_B9ww_0B7b-pbi4YqphR06S28UCsfrQTDdQ3EAMgA1vrzVQnh&__tn__=%2CO%2CP-R,,POS,0.48317578434944153,0.039908383041620255,0.4769159257411957,NEG
55,3 de junio a las 4:19 pm,Reflexión sobre los síntomas de los problemas,0,Hola,8 veces compartido,https://www.facebook.com/evargaspena/videos/1023006673144423/?__cft__[0]=AZVuVW6DRHm_TNxLn0cSfXfGVTjN2xfVfKoyHwCwm_SCFC597yexIK79hVgbToE5E5Wzbfou17cxNRQoIoxeKjyyZtNEj05FY-aaGWvpDeRrUhQXWEeomnfygQHm5xyi1UFBYsuBsMxq-pGdgFXN39xnzHpj0NBy9ZKT2AUY53mUe9ZxlKgxTvZJ7E6QY8Ya_1Eq6Gtc6p1EinLKabBXPBzM&__tn__=%2CO%2CP-R,,NEU,0.0771918073296547,0.3528237044811249,0.5699844360351562,NEU
56,3 de junio a las 3:38 pm,"Vicemin de Energía @MauriBejarano, @mopcparaguay, coincidió, esta mañana en LPM por la 7.30 AM ABC Cardinal, Paraguay, en que urge el acuerdo del gasoducto de Vaca Muerta con Argentina y Brasil porque las energías ""limpias"" no son seguras",0,"Las energías limpias son seguras en comparación con las fuentes tradicionales, siempre que se diseñen e implementen correctamente. Como cualquier tecnología, no están exentas de riesgos, pero estos son menores, más controlables y menos dañinos que los …",1 vez compartido,https://www.facebook.com/evargaspena/posts/pfbid0qwJ1VMSnYfg9ZfEMhpxtqQHpUzhts3PwTN9JRLztfTLZuSoLurMpLySRVECxMLTrl?__cft__[0]=AZVcwtRstaC8GNLTHv6XMwcKopm4YQjhVTjsZ35uLOFVEfKMHlQ7-SJd49v1Rzr6CFh5lXmnxbtgtdIxxgoSzw7pYIqUsu2M14WKrTENJEFftdqPXmF9HtRgSTj7SAcjdc-xGzi5zzOFbSh2eJurjW64CNHxiUtq-3qjnoVmq3UgrjrUJfrGqb_JzES5nrsUJ6A&__tn__=%2CO%2CP-R,,NEG,0.016176637262105942,0.7814174294471741,0.2024059295654297,NEU
57,3 de junio a las 7:33 am,"Comisaria Lucía Ávalos, Dpto Desapariciones @policia_py, precisa, en la 7.30 AM ABC Cardinal, Paraguay, que tiene 17 efectivos y que no asignan detectives por caso. Agrega que no todos están siempre. Le digo que eso explica por qué tienen que esperar que se les avise",0,,2 veces compartido,https://www.facebook.com/evargaspena/posts/pfbid02Gvd28CAxnApLH5PSjStyKMYVeNjU2VhE1ntWZTkgwjT4GW2YS8psFWKHp2n6QRthl?__cft__[0]=AZVXk3Dd20NMDmHdY4YK7CvmZDJ9LU-IbGZvrh-3iO57Xj3mU42-eBQogbYez24JBy72XRqFbbI5qcgbBHPbqRr-R-nhXWVNjdB0c2l0hJkdAV90oxQ5NoaiHBxuNRS7HArfgqoqtbCN15XdkizhRq0bukQ6WP9pEPKtjSqnxqHCwAPBW6okgwLYbAtAYPZGhcw&__tn__=%2CO%2CP-R,,NEG,0.012252303771674633,0.6261858940124512,0.3615618348121643,SIN_COMENTARIO
58,3 de junio a las 7:22 am,"Comisaria Lucía Ávalos, Dpto Desapariciones @policia_py, admite, en la 7.30 AM ABC Cardinal, Paraguay, que de 900 denuncias de desapariciones producidas de mayo 24 a mayo 25, unas 450 están pendientes de resolución ""porque los denunciantes no llaman a actualizar la situación""",0,"Hay que decirle a ese comisario que ellos, las autoridades, deben estar en constante comunicación con las personas que reportaron una desaparición para cerciorarse si apareció, no es tan difícil…",1 vez compartido,https://www.facebook.com/evargaspena/posts/pfbid027wabL2h7guEEEGxYGAj743z7Z4JR6WqkopDEUcwVfmDiB2cgMRj9vvmNjJZLiMnSl?__cft__[0]=AZUVKcF_I9PdGpwbSAuXgaoVl4Privlcx5IhgC2A8opWCNIB0evYhLsemVALEP9ad_Qa3zEX8Rv1wwXGsKkSHx-8SCgZuh_bqIAEtJ5KOTOIiEP0jf69mSH6SyNegFsrPlXkkumeXwdGJtm7gdP9kXbc97QEPJXohMNWnV7YXcjEmN8NqWsPv_8H2Sho_2nJZ_c&__tn__=%2CO%2CP-R,,NEG,0.012491673231124878,0.700259804725647,0.28724855184555054,NEU
59,3 de junio a las 7:02 am,"Dip @RocioVallejoA critica, en la 7.30 AM ABC Cardinal, Paraguay, que algunos liberales se hayan negado a integrar comisión de @DiputadosPy sobre intervención de @AsuncionMuni con el objeto de deslegitimar el proceso: ""El resultado es dejar a los colorados solos como única voz""",0,"Estrategia de mala fé, nadie de estos liberales quiere avalar y ser testigo de la corrupción imperante en la comuna, quedarían al descubierto el encubrimiento que estaban haciendo.... después saldrán a decir que los que revisaron plantaron pruebas para…",,https://www.facebook.com/evargaspena/posts/pfbid0KacFuwcFNSnfbkFnPjkTCdbdzJJK7Dqg5e7FMeiZc3n19cZn3DwijvTJLQDK89Hql?__cft__[0]=AZV6ovKGv9LPgOF46bAKwWRwEthwNTwAepoo7nxa-LrydmqPtEiarK0KwFA9GqURQr3uJYqWLHQcLONIXv1YFmla8qFTrKEVtkGEp5a3uiovtdokcYJ4tlLHI0-YmPSuz8lW1m30wMfFLhoFICwotOhFyXqX_qL72sy2SLsfJwvPh154vIogKn7xlU5tVIw00JI&__tn__=%2CO%2CP-R,,NEG,0.005445076618343592,0.9173455834388733,0.07720930129289627,NEG
60,3 de junio a las 6:43 am,"Dip @RocioVallejoA explica, en la 7.30 AM ABC Cardinal, Paraguay, que comisión de @DiputadosPy sobre intervención de @AsuncionMuni espera a su pte designado @rodrigamarrak, que llega hoy de viaje, para actuar. Estima que esta semana estarán convocados @nenechopy y @contraloriapy",0,,,https://www.facebook.com/evargaspena/posts/pfbid0U5uoUdPLexc4uKgKuWXuBVHoZwp1Zu7BFovuUqKYoZGdmUb47VQegh93SgwHK4BKl?__cft__[0]=AZUqM7i0BAna8IGwggiyAYto_E3yof2DkeeGLDUW67GbW4TQaEbJIgdx3jwV9SdSAQxOQeY03guwURGRXtGMM3kmxCVMWtFEJLDvXCMkDZCV8yIE7hoMnaASh7Z55i-424unwbFKG4m8lic-4P29pMdDEaz6D9SE3wMJJloEw2OlEIG33t24RfsBl6alSrLVRbE&__tn__=%2CO%2CP-R,,NEU,0.10991867631673813,0.11294609308242798,0.7771351933479309,SIN_COMENTARIO
61,3 de junio a las 5:30 am,"Hola, hasta las 08:00 estoy en 7.30 AM ABC Cardinal, Paraguay. Deportes con Ariel Julian Marecos",0,Bieenn,,https://www.facebook.com/evargaspena/videos/690672523935879/?__cft__[0]=AZUF1TyLR4qrANkrpcCgE9Bo3UZ31awMI_K4uD7nJQ_H6rtQG_Wx5Q_zWtA27_Pw4SlTS4Br3sww2hK_AsOZk3B-DbZOshyGyc9WMyM_zr5F2nUTh8xrEPGo7TgCHqfqctm9fzPeIGJ3nAUjq_6M4vi90X_qZdG_wgZd7MvIsUMY0YyxMt56QQyS5P8-UfnCZtt2xQ88EQvCPMEZplOzXaAj&__tn__=%2CO%2CP-R,,NEU,0.21240070462226868,0.031092524528503418,0.7565068006515503,POS
62,3 de junio a las 4:04 am,"Anoche hablamos con @felipegsoley, nuevo vicemin de Economía @MEF_Paraguay, sobre déficit fiscal, crecimiento, ineficiencia del Estado y cajas fiscales. Con la diputada @DaliaE_Py sobre ""masculinicidio"" y discriminación de género en ley 5777",0,,,https://www.facebook.com/evargaspena/videos/678508998381258/?__cft__[0]=AZVTW_KR62GmXmtntY_SdEK-6hMaNlVVGkyGUnKRmFrWOBEN9e3ei4cNciJa3O50eXkhpMsywpcoWPeCMpw7jKpwphXnjbaxVgdDPa-q074ipUPxU9OpW3YbrAkG__rLAiHbztCgJsMLAFeoxcYze_gc2SE58GEIKJYLnPgEY_ycpCMxmlJnc_lio3M4X-PLzCDyyLgLZXXjUhH7PMrhhpg7&__tn__=%2CO%2CP-R,,NEG,0.030502809211611748,0.6347620487213135,0.33473506569862366,SIN_COMENTARIO
63,2 de junio a las 7:59 pm,"A partir de las 20 horas estoy en ABCTV, en ""Mesa"", canales 19 de TigoStar y 3 de Personal tv",0,No se olviden también de este muchacho Enrique ! La violencia no tiene genero,,https://www.facebook.com/evargaspena/videos/677641538396011/?__cft__[0]=AZVigkh6Eil9iefykCEmFhMN-XcjJA_94Wr4ySCRDCc4u6UCd9GUlSWzns2ssWSc2YXeudL2eim6s-jlLLH3c40uY8oTFfXqxOj5iIE2_TfEqoX6KZmwjrjKLoZ-ltyZBWMRxTmvDvCqaBYoWLeJMYkrR19AzWSamS-PJA3QROFRlzthHUyivgv_J0SP65l51X5uuvRhbZxZcA5jjP8O970C&__tn__=%2CO%2CP-R,,NEU,0.15050607919692993,0.04011036828160286,0.8093835115432739,NEU
64,2 de junio a las 7:22 pm,De que el proyecto totalitario fascista del Foro (@wef) es un retorno a la Edad Media queda probado con la restauración de las leyes de blasfemia en varios paises de Europa. Son un asco. Nazis de mierda!!,0,,4 veces compartido,https://www.facebook.com/evargaspena/posts/pfbid02TQbSCSnK1YPfRHFV15i7aAQqiULoq52gH9SUJ1fg1xHDAwohyYwiUZbQFKgsJTX1l?__cft__[0]=AZXVnpQSXGEtC6CopKWEbcWbHqG9aWE6zsXiRk5ellsW_J6dO59ThfISCPPo4JfXlmuQXMbGt3mE-Vq-MSzEqAfnJmA24WVm95lGGg41JlxxML1Tk_2E0weF4CmgZbdh0mGHEEzkzIZFSMHko2L-WOSMzCG9hqmcXdEbL1-y0aFO0s1ZD2cI5WdTzLIHG-1-zV8&__tn__=%2CO%2CP-R,,NEG,0.006542464252561331,0.9687018990516663,0.024755699560046196,SIN_COMENTARIO
65,2 de junio a las 5:47 pm,"Desde las 17 y hasta las 19 seguimos con @figuejuanma en la 98.5 ABC FM, sólo  éxitos",0,,,https://www.facebook.com/evargaspena/posts/pfbid0ekNJJLT41pzCMDhrVHvursq4zDVV8gfbzAGzdMTHeDCSNQWrM5Dogwf38e7aSPLHl?__cft__[0]=AZXevmaMO9oA57qA-ijYg5v6-2B8rEYxEfAM3ExYFERP3TIYPFoVKrERs3v7ISbnNZSfV-Utw3FGd2vlkYNK1voXnYOQ30vamNquiqMsdMJBYuQpB-eCGmuIvViq5jnjDgwRFx1sE-ouv0fWEeFc23TWChbWfe4GvZTIiRqky459Y6rnkr8nXwmfe8tv4wwS3idPMCil75h18gYWtHqRLWML&__tn__=%2CO%2CP-R,,POS,0.48317578434944153,0.039908383041620255,0.4769159257411957,SIN_COMENTARIO
66,2 de junio a las 4:37 pm,Intensa apertura de semana,0,Hola,7 veces compartido,https://www.facebook.com/evargaspena/videos/699349379373485/?__cft__[0]=AZXT6t3SKyNL8nVvYyU9xYjV-nRPLOgjl3zs7xauD0HJ4bU5fthbsVebdSaDAqquiFHzUDdFSF0h8rtGI-FRKtW_litNJ7pIl2zIIT6HZnMtsFtEFRvkUifwiCuFGs3O1_Mp8R7Oj6ui1ZRYIJu_4AU69KU_ldCdUOOzwT1bkelpSfjCCp_edRGmGUaVkkusg1xc8bfF1Jy0NX58PJJlV-pF&__tn__=%2CO%2CP-R,,POS,0.7780563831329346,0.027447717264294624,0.19449588656425476,NEU
67,2 de junio a las 7:04 am,"Diputado @CandiaDiego, @PrensaHonor, @ANRParaguay, recuerda, en la 7.30 AM ABC Cardinal, Paraguay, que es originario del equipo político del intendente @carlosintendent y que es pre candidato a la intendencia de Luque y que él se ofreció como candidato a integrar el @Jem_py",0,"Ese es un corrupto socio del hijo de Óscar González Daher,bandido sinvergüenza,pregunten por qué se le llama concejal veloz?",,https://www.facebook.com/evargaspena/posts/pfbid0fjNk88RQd2yApwXRxsN337VnKDMFoTeXipBp8GfSwGPvn3GobmAAze75sKGqStTnl?__cft__[0]=AZX8XEu6h26aFtuslrb-s30yp0pcPDgiWv3pHeyRGXfFyGk-gi5yzXDJw9jwYSNjp0iWdq4w5NRejQS4IEzywNd2NAQPsFKvJPtYfL0hZo6bm6hr0-X_D4c2rEhZPlxawGtSXITUg1XxHS9ttx7qo4J9C9RZVyURurmU8la6hdH-CcwUcDQVwiSIPiT1xCv9fUg&__tn__=%2CO%2CP-R,,NEU,0.14485648274421692,0.06473029404878616,0.7904132008552551,NEG
68,2 de junio a las 6:45 am,"Diputado @CandiaDiego, @PrensaHonor, @ANRParaguay, expone, en la 7.30 AM ABC Cardinal, Paraguay, su curriculum para el @Jem_py: Egresado UNA 2007, asesor jurídico y litigante y sugiere que, a diferencia Hernán Rivas y Orlando Arévalo, conoce el sistema a cabalidad",0,,,https://www.facebook.com/evargaspena/posts/pfbid02YSQMcjo1mqwatJt8zpv5HJcN3ytpiReJw6wT3QL2L9WxVkHYB8Dm2398w2u5mwvql?__cft__[0]=AZXQbEef0ybmk5PmxLDk6qk3ocsGB9Otf_sQ-cSOyH7Hd6MJ9ilmSw_66XVnfK4EjLDuPjXiMvCZO4oNTbwtHRD55_WKA1HjGsGdaCvL_drnuXDGydivYwEeR0yhJQXXd36pXxmQO5UALyLDlEU_G1nt3RQZ8W-u6rd2RPq-STwR1xoYYhBLbLk0-aDD7UnEKwk&__tn__=%2CO%2CP-R,,NEU,0.1549018770456314,0.056157443672418594,0.7889406681060791,SIN_COMENTARIO
69,2 de junio a las 6:17 am,"Robert Marcial González, abogado de @KattyaGonzalez9, coincide, en la 7.30 AM ABC Cardinal, Paraguay, en que la oposición validó los precedentes de facto de no acatamiento de @SenadoresPy a la Corte, @PoderJudicialPY. Estima que ahora es oportunidad de corregirlo",0,"Con Lugo la oposición no acataron la orden judicial y estaba todo bien porque ellos eran lo que hacían, hasta le metieron a un senador que no juro (Friedmann) y seguia estando bien, pero ahora que le toca a ellos está todo mal, que hay que acatar la or…",2 veces compartido,https://www.facebook.com/evargaspena/posts/pfbid02wLckipX8Sj62F1GV1xJ39yniQazVVa2Q6BWr6DoafRj659rEg3EiyYhdm2zkyKLHl?__cft__[0]=AZUvlo8j2cpXt-W2uW2ARdcXMZEeN-kSqo7BdTgOzum4LmRC5oqzR6V8qlI47iwMIB-3RuV-rGL0Do1ylsuFZoMyLFt83MwhwB_C270alQo188GrCVK7074TlwzEryUCJrkLYtqZoS6QTmcgu27QVwHuoDFMzxFT-HZ4Cmxn3gIrbT2_BP4OF-xieLgbDTtREno&__tn__=%2CO%2CP-R,2.0,NEU,0.06539309024810791,0.34200194478034973,0.5926050543785095,NEG
70,2 de junio a las 6:11 am,"Robert Marcial González, abogado de @KattyaGonzalez9, se muestra optimista, en la 7.30 AM ABC Cardinal, Paraguay, sobre resolución en la Corte Suprema, @PoderJudicialPY, del caso del retorno de su hermana a @SenadoresPy. Pero pesimista sobre su imperio en @SenadoresPy",0,No va pasar eso,,https://www.facebook.com/evargaspena/posts/pfbid0zaTbBPvYqGxcnMxetcusc8okRaMwoEVfydwvKKicFDqhG2rcBTEcPoA8yrLm29hVl?__cft__[0]=AZWofinE07nYxH-nOTx3LNVMOc3Jh3nes8aMHhk5n6-Ggqa5ab3o5Op9n3XPkt2MhYh9Z665mH0w3hI3CCdfM1jzbz6dp0tZPs7j-1BLcX3893V6St3h_YYeu8p32J3UZBNFkgEjvW8_lWxT68x1eIhApVP9v-NxUeRav6SyFZp0zqTjEV6_mK348pqgV461dCs&__tn__=%2CO%2CP-R,,NEU,0.05831705033779144,0.2632262110710144,0.6784566640853882,NEU
71,2 de junio a las 5:37 am,"Hola, hasta las 08:00 estoy en 7.30 AM ABC Cardinal, Paraguay. Deportes con Ariel Julian Marecos",0,Desastre co Enriqueta,,https://www.facebook.com/evargaspena/videos/1074231174554916/?__cft__[0]=AZWLS5Qxt-h_Mb5q0ktSeeDumGi7MoZekmV2IqbV-DVt0OuB8j_qELXdlMvTS7DSsVFZLOFZwOs4WKaJVFJnVCUMfD318W6q5buj8h01beNQJ3jqPH9E5JGC9AXtBnUoMyCEf09E_mvxOLFf8v22KaZ7OF4Nqg5oh-zvaNqlhbU-eVwCHoaJBK79LHrCl-CRlHb_F4WBCK0vG5CV0NgQIA4b&__tn__=%2CO%2CP-R,2.0,NEU,0.21240070462226868,0.031092524528503418,0.7565068006515503,NEG
72,2 de junio a las 4:12 am,"El viernes hablamos largamente con el videpresidente de la República, @AllianaPedro, sobre @Muni_CDE, @nenechopy, @KattyaGonzalez9, su candidatura presidencial y la @ANRParaguay contra el globalismo",0,Cada vez estás,2,https://www.facebook.com/evargaspena/videos/2188261468290193/?__cft__[0]=AZUuCQATyd_78gVQJSXP365WMQysj7kumL13GWH1U2ta5XEB4uccWLEKXgmhF3e4f3PQYigmv836q7OmZAHAVXNNtz0hQAj_sGjWFMedirFrY4upvESzhrz_d7ZsTUIkipdtjF4pOUSU9tSkg_5ITUm2aA9r8IlCnPaFgC4PXoxjqff0t8rGYfAauJwXO3_SdNCNIMMKesPl7fxldk36iP3s&__tn__=%2CO%2CP-R,2.0,NEU,0.2624219059944153,0.09246545284986496,0.6451126933097839,NEU
73,2 de junio a las 3:55 am,"Anoche, Leando Villalba, @contraloriapy, confrontó a @emiliocamachop, Juan José Armoa, @AsuncionMuni, y  @marcelo_duartem sobre dictamen por el que el Poder Ejecutivo pidió intervención de @AsuncionMuni y de @Muni_CDE",0,,3 veces compartido,https://www.facebook.com/evargaspena/videos/1033838305483246/?__cft__[0]=AZXX6nz4uC3oQ3fE7e29lKZozGvi4LemqvuXK_P7EjUp6tSBNH0JtdGiksWzYlAYZwrtWQ7HUrwbcnf0KB5u9dW-Q04rjfMxoazWpveAuqjLyOcnHyNmDNJ_Ajd6BCogyR4u5HRg88kx3Gtfa6oYm3lDQZ5yy80bftNe1qGJdMsjOUZ6PTzYREH98OObtT8fiQUYMCyZsxsE53KGy8_CAbu-&__tn__=%2CO%2CP-R,,NEG,0.03610049560666084,0.5514643788337708,0.4124350845813751,SIN_COMENTARIO
